<?xml version="1.0" encoding="utf-8" ?>
<!-- DATA STRUCTURE FOR USERS, CLIENT + ADMIN -->

<users xmlns:xsi="http://www.w3.org/2001/XMLSchema-instance" xsi:noNamespaceSchemaLocation="users.xsd">
  <user>
    <userid>0025</userid>
    <usertype>Client</usertype>
    <name>Dylan Marley</name>
    <username>client</username>
    <password>123</password>
  </user>
  <user>
    <userid>0001</userid>
    <usertype>Admin</usertype>
    <name>Morgan Freeman</name>
    <username>admin</username>
    <password>pass</password>
  </user>
</users>
